index,url,valid,domain,title,description,image,published,archive,content,quote,language,keyword
70,https://www.celebitchy.com/946911/queen_camillas_gothic_vatican_headpiece_was_a_custom_piece_by_philip_treacy/,0,www.celebitchy.com,Queen Camilla’s gothic Vatican headpiece was a custom piece by Philip Treacy,"Here are more photos from King Charles and Queen Camilla’s visit to the Vatican yesterday. I’ll give Cam some credit: if she hadn’t worn that absolutely bonkers headpiece, the meeting and photos would not have gotten this much attention. I believe people were…",,2025-10-24T15:10:07Z,,"Here are more photos from King Charles and Queen Camillas visit to the Vatican yesterday. Ill give Cam some credit: if she hadnt worn that absolutely bonkers headpiece, the meeting and photos would n… [+8874 chars]",,en,'Vatican'
71,https://petapixel.com/2025/10/24/aerial-photographer-reveals-the-beauty-of-swedens-island-archipelago/,0,petapixel.com,Aerial Photographer Reveals the Beauty of Sweden’s Island Archipelago,"The Nordic country of Sweden has over 260,000 islands -- the most of any country in the entire world. Recently, photographer Bernhard Lang explored a handful of them from above, picking out patterns that are invisible from the ground.
[Read More]",https://petapixel.com/assets/uploads/2025/10/Bernhard-Lang.jpg,2025-10-24T15:44:58Z,,"From Archipelago by Bernhard Lang
The Nordic country of Sweden has over 260,000 islands — the most of any country in the entire world. Recently, photographer Bernhard Lang explored a handful of them… [+2097 chars]",,en,'Bern'
72,https://www.r-bloggers.com/2025/10/mapping-antarctica/,0,www.r-bloggers.com,Mapping Antarctica,"Creating maps with R is usually straightforward, but representations that
cross the International Date
Line or that use polar
projections can be tricky.


Continue reading: Mapping Antarctica",https://dieghernan.github.io/assets/img/blog/202510_good_pol-1.webp,2025-10-24T22:00:00Z,http://web.archive.org/web/20251115110521/https://www.r-bloggers.com/2025/10/mapping-antarctica/,"Cool maps from the South Pole
6 min.
Creating maps with R is usually straightforward, but representations that
cross the International Date
Line or that use polar
projections can be tricky.
Dif… [+9177 chars]",,en,'Antarctica'
73,https://www.abc.net.au/news/2025-10-25/bird-flu-h5n1-likely-present-in-heard-island-elephant-seals/105931840,0,www.abc.net.au,Scientists fear bird flu outbreak after elephant seal deaths on Heard Island,"Scientists suspect a deadly strain of bird flu, H5N1, has infected wildlife on Heard Island after observing a high mortality rate in elephant seals on the Australian territory in the sub-Antarctic.",https://live-production.wcms.abc-cdn.net.au/5fbdf967bb501568ace00f5129e6362e?impolicy=wcms_watermark_news&cropH=2442&cropW=4341&xPos=0&yPos=452&width=862&height=485&imformat=generic,2025-10-24T22:57:48Z,,"Scientists who recently travelled to Heard Island in the Southern Ocean fear a deadly strain of bird flu, H5N1, may be infecting wildlife after observing unusually high mortality among elephant seals… [+6980 chars]",,en,'Heard Island and McDonald Islands'
74,https://finance.yahoo.com/news/tesla-operates-five-continents-sixth-233116358.html,0,finance.yahoo.com,"Tesla Operates In Five Continents, A Sixth Could Be On The Way With This Country",Tesla Inc (NASDAQ:TSLA) CEO Elon Musk was born in South Africa and spent 17 years there before moving to North America. The billionaire's EV company could be...,https://media.zenfs.com/en/benzinga_79/449c34621fe816d25d43ecf1687a00c6,2025-10-24T23:31:16Z,,"Benzinga and Yahoo Finance LLC may earn commission or revenue on some items through the links below.
Tesla Inc (NASDAQ:TSLA) CEO Elon Musk was born in South Africa and spent 17 years there before mo… [+6684 chars]",,en,'South Africa'
75,https://www.aljazeera.com/news/2025/10/25/tropical-storm-melissa-soon-a-hurricane-brings-death-floods-to-caribbean,0,www.aljazeera.com,"Tropical Storm Melissa, soon a hurricane, brings death, floods to Caribbean",Jamaica prepares for Melissa's arrival as forecasts predict over 72 hours of hurricane conditions and heavy rainfall.,https://www.aljazeera.com/wp-content/uploads/2025/10/AP25298071082668-1761374873.jpg?resize=1920%2C1440,2025-10-25T07:03:42Z,,"The slow-moving, but punishing, Tropical Storm Melissa that has already killed four people is threatening catastrophic flooding across the northern Caribbean as it strengthens towards Jamaica.
Melis… [+2515 chars]",,en,'Jamaica'
76,https://www.independent.ie/irish-news/presidential-election/catherine-connolly-says-she-will-represent-everybody-as-she-acknowledges-inevitable-victory-fine-gael-privately-accept-its-all-over-bar-the-counting/a10757922.html,0,www.independent.ie,Catherine Connolly says she will represent everybody as she acknowledges inevitable victory; Fine Gael privately accept ‘it’s all over’ bar the counting,Follow the latest developments in our live blog:,https://focus.independent.ie/thumbor/Ztonf4BYxOQ8wNbeR84qzw3JRVg=/60x0:735x450/629x0/prod-mh-ireland/91a1470b-5bc3-4da3-a7ec-d64e366219e8/56d21a59-886c-4084-8a1e-b9c831a194b3/video/video.jpg,2025-10-25T08:00:00Z,,"Roughly a quarter of boxes have now been counted in the Dublin Mid-West constituency, where Catherine Connolly is polling strongly with roughly 59pc of first-preference votes.Counting is taking place… [+465 chars]",,en,'Dublin'
77,https://grist.org/science/mosquitoes-found-in-iceland-for-first-time-as-climate-crisis-warms-country/,0,grist.org,Mosquitoes found in Iceland for first time as climate crisis warms country,Three specimens were discovered in what was previously one of the few places in the world without the insects.,https://grist.org/wp-content/uploads/2025/10/iceland-mosquito.jpg?quality=75&strip=all,2025-10-25T13:00:00Z,,"This story was originally published by The Guardian and is reproduced here as part of the Climate Desk collaboration.
Mosquitoes have been found in Iceland for the first time as global heating makes… [+1960 chars]",,en,'Antarctica'
78,https://www.nbcnews.com/weather/storms/tropical-storm-melissa-hurricane-updates-rcna239732,0,www.nbcnews.com,"Tropical Storm Melissa, forecast to become major hurricane, barrels toward Jamaica and Cuba","Tropical Storm Melissa is expected to intensify into a hurricane in the Caribbean on Saturday, bringing with it catastrophic flash flooding and potential landslides","https://media-cldnry.s-nbcnews.com/image/upload/t_nbcnews-fp-1200-630,f_auto,q_auto:best/rockcms/2025-10/251025-Tropical-Storm-Melissa-ch-0929-4faa60.jpg",2025-10-25T14:31:31Z,,"Tropical Storm Melissa is expected to intensify into a hurricane in the Caribbean on Saturday, bringing with it catastrophic flash flooding and potential landslides.
The slow-moving storm is already… [+1514 chars]",,en,'Cuba'
79,https://economictimes.indiatimes.com/news/international/us/tropical-storm-melissa-hurricane-jamaica-catastrophic-flooding-storm-surge-and-wind-damage-across-jamaica/articleshow/124809828.cms,0,economictimes.indiatimes.com,Deadly storm Melissa to turn into Monstrous Hurricane: Ravaging flooding alert in Jamaica — All about the ‘extreme threat’,"Tropical Storm Melissa, responsible for multiple fatalities in the Dominican Republic and Haiti, is nearing hurricane strength, sparking concerns over severe flooding, powerful storm surges, and extensive wind damage in Jamaica and surrounding regions.","https://img.etimg.com/thumb/msid-124809957,width-1200,height-630,imgsize-152094,overlay-economictimes/articleshow.jpg",2025-10-25T16:29:34Z,,"What began as a powerful tropical storm is rapidly morphing into a major threat for the Caribbean. Tropical Storm Melissa, which has already claimed several lives in the Dominican Republic and Haiti,… [+5603 chars]",,en,'Dominica'
80,http://twistedsifter.com/2025/10/city-of-detroit-is-relying-on-autonomous-robots-to-perform-common-maintenance-tasks/,0,twistedsifter.com,City Of Detroit Is Relying On Autonomous Robots To Perform Common Maintenance Tasks,Robots are helping to clean up the city of Detroit.,https://twistedsifter.com/wp-content/uploads/2025/08/Penny-Pikcup-Detriot-Trash-Robot.jpg,2025-10-25T16:55:09Z,,"Crains Detroit Business
People are constantly talking about advancements in robotics, with many events taking place showing the latest in this technology. The city of Detroit, however, is pushing fo… [+3265 chars]",,en,'nan'
81,https://www.yahoo.com/news/articles/melissa-bring-catastrophic-impacts-western-170735106.html,0,www.yahoo.com,"Melissa to bring catastrophic impacts to the western Caribbean: Haiti, Jamaica and Cuba at risk","Melissa has already turned deadly across Haiti and the Dominican Republic, but AccuWeather meteorologists warn that the worst may be yet to come with the...",https://media.zenfs.com/en/accuweather_articles_339/35a4e7b03b6aade2498d598c95c786ea,2025-10-25T17:07:35Z,,"As Hurricane, Melissa slowly churns across the warm waters of the Western Atlantic over the upcoming days, AccuWeather hurricane experts continue to sound the alarm bells that a very dangerous and de… [+6261 chars]",,en,'Dominican Republic'
82,https://www.bbc.com/news/articles/cgkzg680j7lo,0,www.bbc.com,Charity boss arrest in BBC sex-for-aid investigation 'gives women strength',Syrian refugees in Turkey allege they were taken advantage of when they were desperate for help.,https://ichef.bbci.co.uk/news/1024/branded_news/4338/live/bb4c3060-b0bf-11f0-aa13-0b0479f6f42a.jpg,2025-10-25T23:19:28Z,,"Fundanur Ozturk,BBC News Turkish and 
Kawoon Khamoosh,BBC World Service
Turkish charity owner Sadettin Karagoz denies allegations that he sexually assaulted refugees who came to him for aid
A Turk… [+6399 chars]",,en,'Turkey'
83,https://www.irishtimes.com/ireland/2025/10/25/ive-got-an-amazing-muinteoir-kara-owen-the-new-british-ambassador-to-ireland/,0,www.irishtimes.com,"‘I’ve got an amazing múinteoir’: Kara Owen, the new British ambassador to Ireland","Owen talks about her marriage to a Galwegian, the Irish phrases that were common in her Cumbrian childhood, and her daunting Irish-speaking debut with Michael D Higgins",https://www.irishtimes.com/resizer/v2/NE7JYKBXCBBU3H2WZN2GEIYTF4.jpg?smart=true&auth=601c1bba03c6178f922aa994710e85ffd1b9cda2d419fcbaa6bf0b8820b6dc95&width=1200&height=630,2025-10-26T06:00:00Z,,"Kara Owen may be the newly installed British ambassador to Ireland, but she is not newly arrived. Indeed, there can be few ambassadors who have ever taken up a role furnished with such connections to… [+7902 chars]",,en,'Ireland'
84,https://www.theatlantic.com/international/archive/2025/10/gaza-peace-deal/684688/,0,www.theatlantic.com,No One Knows How to Pull Off the Gaza Peace Deal,Disarming Hamas may be a task that only the Israeli military can handle.,https://cdn.theatlantic.com/thumbor/nJoYmEAJG-iQu5bQn2ozCUk-hJ8=/160x0:4914x2476/1200x625/media/img/mt/2025/10/2025_10_24_The_Case_For_Pessimism/original.jpg,2025-10-26T11:00:00Z,,"The October 13 peace summit in Sharm al-Sheikh—where Donald Trump assembled more than 30 world leaders, including Turkish President Recep Tayyip Erdoğan and (for some reason) the international soccer… [+5520 chars]",,en,'Gaza'
85,https://www.yahoo.com/news/articles/irelands-president-elect-left-wing-142537883.html,0,www.yahoo.com,"Ireland's president elect is a left-wing, anti-establishment figure who is outspoken on Gaza",Ireland's president for the next seven years is an independent lawmaker who has long spoken in support of Palestinians and has been vocal about her distrust ...,https://s.yimg.com/ny/api/res/1.2/.LAJ2LqOsiu27JazHiTF1w--/YXBwaWQ9aGlnaGxhbmRlcjt3PTEyMDA7aD04NjM7Y2Y9d2VicA--/https://media.zenfs.com/en/ap.org/d9b830fa9a1930915d6b46e431190b00,2025-10-26T14:25:37Z,,"LONDON (AP) Ireland's president for the next seven years is an independent lawmaker who has long spoken in support of Palestinians and has been vocal about her distrust of European Union policies.
L… [+3613 chars]",,en,'Gaza'
86,https://www.jpost.com/israel-news/article-871681,0,www.jpost.com,Family of Gaza hostage Alon Ohel starts crowdfunding campaign to support rehabilitation,"After 738 days in captivity, Alon Ohel has returned home. His journey to recovery begins with a nationwide effort to support his healing and rehabilitation.",https://media.zenfs.com/en/jerusalem_post_articles_818/05684a7934d646a46d9c26c962c2cfeb,2025-10-26T14:31:15Z,,"After 738 days in captivity, Alon Ohel has returned home. His journey to recovery begins with a nationwide effort to support his healing and rehabilitation.
The family of Alon Ohel has launched a cr… [+1949 chars]",,en,'Gaza'
87,https://www.foxweather.com/weather-news/hurricane-melissa-jamaica-haiti-cuba-dominican-republic-caribbean-atlantic,0,www.foxweather.com,"Melissa upgraded to Category 4 hurricane, Jamaica braces for potential 140-mph winds","The NHC said strengthening is expected to continue, and the storm will likely become a catastrophic Category 5 hurricane as it creeps closer to Jamaica.",https://nypost.com/wp-content/uploads/sites/2/2025/10/hurricane-melissa-comp-114233178.jpg?quality=75&strip=all&w=1200,2025-10-26T14:52:49Z,,"KINGSTON, Jamaica  Time has essentially run out for millions of people in Jamaica to prepare for deadly Hurricane Melissas onslaught as the monster storm undergoes “extreme rapid intensification” ahe… [+8354 chars]",,en,'Jamaica'
88,https://www.yahoo.com/news/videos/hamas-says-expanded-search-bodies-182215440.html,0,www.yahoo.com,Hamas says it has expanded its search for the bodies of hostages in Gaza,"Hamas has expanded its search for bodies of hostages in the Gaza Strip, the Palestinian group said Sunday, a day after Egypt deployed a team of experts and...",https://s.yimg.com/ny/api/res/1.2/X68Vu3lK_M_NaIU_zjrxTw--/YXBwaWQ9aGlnaGxhbmRlcjt3PTEyMDA7aD02NzU7Y2Y9d2VicA--/https://cf-images.us-east-1.prod.boltdns.net/v1/jit/6415665815001/c3c886d1-8fac-473f-80c6-d5aa210aaa5f/main/1280x720/18s677ms/match/image.jpg,2025-10-26T18:22:15Z,,"Hamas has expanded its search for bodies of hostages in the Gaza Strip, the Palestinian group said Sunday, a day after Egypt deployed a team of experts and heavy equipment to help retrieve them. Unde… [+212 chars]",,en,'Gaza'
89,https://gizmodo.com/trumps-tiktok-deal-will-supposedly-close-on-thursday-2000677252,0,gizmodo.com,Trump’s TikTok Deal Will Supposedly Close on Thursday,"The U.S. and China are set to ""consummate"" the deal this week in South Korea, Treasury Secretary Scott Bessent says.",https://gizmodo.com/app/uploads/2025/10/tiktok-culver-city-1200x675.jpg,2025-10-26T20:10:20Z,,"U.S. Treasury Secretary Scott Bessent has been in Malaysia for two days engaging in trade negotiations with representatives from China. Apparently it’s been, as Bessent put it in a Sunday appearance … [+1849 chars]",,en,'UK'
90,https://www.bbc.com/news/articles/cx2l0mjkjkvo,0,www.bbc.com,Egypt and Red Cross join search for hostage bodies in Gaza,"Israel said the teams have been permitted to search beyond the so-called ""yellow line"" in the area controlled by its forces in Gaza.",https://ichef.bbci.co.uk/news/1024/branded_news/f04a/live/0a6cf540-b286-11f0-8aca-bd97d0c61a73.png,2025-10-26T20:39:24Z,,"Frank Gardner,Security correspondent , Jerusalem 
Egyptian equipment crosses into the Gaza Strip
Teams from Egypt and the International Committee of the Red Cross (ICRC) have been allowed to search… [+3810 chars]",,en,'Turkey'
91,https://www.abc.net.au/news/2025-10-27/lachlan-strahan-diplomat-solomon-islands-china-foreign-affairs/105933764,0,www.abc.net.au,Diplomat's memoir gives an insider's look at Solomon Islands-China deal,"Former diplomat Lachlan Strahan used his memoir to criticise parts of the Coalition government's response to Solomon Islands' 2022 deal with China, while revealing some Australian officials pushed to impose ""punitive"" measures on Solomon Islands if it deepene…",https://live-production.wcms.abc-cdn.net.au/4553b690122c61622ce4ff472b89e67e?impolicy=wcms_watermark_news&cropH=720&cropW=1280&xPos=0&yPos=66&width=862&height=485&imformat=generic,2025-10-26T20:48:48Z,,The former official who was Australia's top diplomat in Solomon Islands when the Pacific nation signed a deeply contentious security agreement with China says Labor was wrong to claim it could have s… [+9245 chars],,en,'McDonald Islands'
92,https://www.bbc.com/news/articles/cly1qr6z40po,0,www.bbc.com,Warning after Temu cleaning brush rips out child's hair,Norfolk Trading Standards says the £4 cleaning brush has now been withdrawn from sale in the UK.,https://ichef.bbci.co.uk/news/1024/branded_news/5c4f/live/02216040-b01c-11f0-ba75-093eca1ac29b.jpg,2025-10-27T00:05:37Z,,"The three-year-old girl needed medical attention after the incident
A mother whose three-year-old girl's hair was ripped out by an electric cleaning brush says the internet giant Temu ""does not care… [+3077 chars]",,en,'UK'
93,https://www.scientificamerican.com/article/why-hurricane-melissa-could-be-the-worst-storm-to-ever-hit-jamaica/,0,www.scientificamerican.com,Why Hurricane Melissa Could Be the Worst Storm to Ever Hit Jamaica,"Category 5 Hurricane Melissa’s exceptional strength and slow pace could make it more destructive than Hurricane Gilbert, which hit Jamaica in 1988",https://static.scientificamerican.com/dam/m/50c7f60c78dceee6/original/GettyImages-2243186140-Melissa-prep-web.jpeg?m=1761598902.389&w=1200,2025-10-27T04:00:00Z,,"As Category 5 hurricane Melissa bears down on Jamaica, it is poised to be the worst storm to ever hit the Caribbean island, surpassing the damage from Hurricane Gilbert in 1988.
Gilbert, which hit J… [+3929 chars]",,en,'Jamaica'
94,https://theconversation.com/fish-stocks-off-icy-heard-island-bounced-back-when-illegal-fishing-stopped-and-sustainable-fishing-continued-267866,0,theconversation.com,Fish stocks off icy Heard Island bounced back when illegal fishing stopped and sustainable fishing continued,"For years, illegal fishing vessels operated near Australia’s Heard and McDonald Islands. Here’s what happened after they were stopped.",https://images.theconversation.com/files/697655/original/file-20251021-56-dkx7al.jpeg?ixlib=rb-4.1.0&rect=0%2C416%2C2048%2C1024&q=45&auto=format&w=1356&h=668&fit=crop,2025-10-27T05:06:36Z,,In the middle of the Southern Indian Ocean lies a vast underwater volcanic ridge known as the Kerguelen Plateau. At its centre sits Australia’s most remote territory: Heard Island and McDonald Island… [+5350 chars],,en,'Heard Island and McDonald Islands'
95,https://theconversation.com/fish-species-off-icy-heard-island-bounced-back-when-illegal-fishing-stopped-and-sustainable-fishing-continued-267866,0,theconversation.com,Fish species off icy Heard Island bounced back when illegal fishing stopped and sustainable fishing continued,"For years, illegal fishing vessels operated near Australia’s Heard and McDonald Islands. Here’s what happened after they were stopped.",https://images.theconversation.com/files/697655/original/file-20251021-56-dkx7al.jpeg?ixlib=rb-4.1.0&rect=0%2C416%2C2048%2C1024&q=45&auto=format&w=1356&h=668&fit=crop,2025-10-27T05:06:36Z,,In the middle of the Southern Indian Ocean lies a vast underwater volcanic ridge known as the Kerguelen Plateau. At its centre sits Australia’s most remote territory: Heard Island and McDonald Island… [+5348 chars],,en,'Australia'
96,https://everything-everywhere.com/challenger-deep-and-the-mariana-trench/,0,everything-everywhere.com,Challenger Deep and the Mariana Trench,"Podcast Transcript Located in an arc sweeping to the east and south of the Marina Islands and Guam is the deepest part of the ocean, the Mariana Trench.  Running over 2,500 kilometers or 1,200 miles, the very deepest part of the trench is known as Challenger …",https://photos.smugmug.com/Other/n-hRFP2/Podcast-Images/i-TK8Wttv/0/MbhQ5QMVXvVXJnF3DHxw5gxfF5fNPJTLD53g2n6cw/L/1939epart-L.jpg,2025-10-27T05:20:19Z,,"Subscribe Apple | Spotify | Amazon |iHeart Radio | Castbox | Podcast Republic | RSS | Patreon | Discord | Facebook
Located in an arc sweeping to the east and south of the Marina Islands and Guam is … [+11529 chars]",,en,'Guam'
97,https://www.irishtimes.com/sport/soccer/2025/10/27/footballs-fondness-for-ferraris-shows-no-sign-of-abating/,0,www.irishtimes.com,Football’s fondness for Ferraris shows no sign of abating,Mick McCarthy disappointed he was not played on film by Denzel Washington,https://www.irishtimes.com/resizer/v2/XMLS3XEXH5H6JVR6VUMTZUVRS4.jpg?smart=true&auth=373abc8f3e3edb59382ab6b6f90fbe68d24f289102e3862fc88de872903ff36f&width=1200&height=630,2025-10-27T06:00:01Z,,"It was back in 2021 that Carlo Ancelotti was asked to compare managing Real Madrid with the club he left to join them, Everton. Its better to have a Ferrari than a Fiat 500, he replied, a bit rudely.… [+4318 chars]",,en,'Washington'
98,https://www.bbc.com/news/articles/cge5ngz11xpo,0,www.bbc.com,"International troops won't want to enforce Gaza peace, says King of Jordan",King Abdullah tells the BBC there would need to be peace in Gaza before any international forces were deployed.,https://ichef.bbci.co.uk/news/1024/branded_news/e93e/live/0fec83d0-b0d0-11f0-ba75-093eca1ac29b.jpg,2025-10-27T06:01:02Z,,"Fergal KeaneSpecial correspondent
Watch: Would Jordan provide security inside Gaza? The country's king explains his answer to BBC Panorama
Countries would reject being asked to ""enforce"" peace in G… [+7074 chars]",,en,'United States'
99,https://www.npr.org/2025/10/27/g-s1-95164/melissa-category-5-hurricane,0,www.npr.org,Melissa strengthens to a Category 5 hurricane as it nears Jamaica,"Melissa is forecast to make landfall on the island of Jamaica Tuesday, with up to 30 inches of rain and a life-threatening storm surge. Category 5 is the highest on the Saffir-Simpson scale.",https://npr.brightspotcdn.com/dims3/default/strip/false/crop/3402x1914+0+177/resize/1400/quality/100/format/jpeg/?url=http%3A%2F%2Fnpr-brightspot.s3.amazonaws.com%2F71%2Fb0%2Fd90eb461428d87200b9284c5757f%2Fap25299817455989.jpg,2025-10-27T09:39:13Z,,"KINGSTON, Jamaica Hurricane Melissa intensified to Category 5 strength Monday as it neared Jamaica with up to 30 inches (76 centimeters) of rain and a life-threatening storm surge.
Melissa is foreca… [+3278 chars]",,en,'Jamaica'
100,https://www.usatoday.com/story/news/politics/2025/10/27/donald-trump-mri-conditions/86925576007/,0,www.usatoday.com,Trump received MRI at Walter Reed. What health conditions has he been diagnosed with?,President Donald Trump speaking with reporters on Air Force One on his way to Japan revealed he received an MRI at Walter Reed earlier this month.,https://s.yimg.com/ny/api/res/1.2/.TZgGSVvex9HNdOKCVB4OA--/YXBwaWQ9aGlnaGxhbmRlcjt3PTEyMDA7aD04MDA7Y2Y9d2VicA--/https://media.zenfs.com/en/usa_today_news_641/dd1d5351e6ed1e472d2ccfbd6d887d7e,2025-10-27T13:26:45Z,,"President Donald Trump said on Oct. 27 that he received an MRI earlier this month.
Trump went to Walter Reed National Military Medical Center on Oct. 10 for what he called his ""semi-annual physical.… [+3237 chars]",,en,'Japan'
101,https://www.businessinsider.com/best-small-towns-to-visit-florida-recommendations-from-local,0,www.businessinsider.com,I've lived in Florida for over 25 years. These 6 small towns probably aren't on your radar — but should be.,"I've lived in Florida for over 25 years and think Mount Dora, Alys Beach, and Fernandina Beach are some of the best small towns to visit in Florida.",https://i.insider.com/68473500f748d8c055f35442?width=1200&format=jpeg,2025-10-27T13:42:48Z,,"In my opinion, Fernandina Beach is one of the best small towns to visit in Florida.Sean Pavone/Shutterstock
<ul><li>I've lived in Florida for over 25 years and love exploring the state's charming sm… [+4165 chars]",,en,'nan'
102,https://www.allrecipes.com/jerky-recall-sams-club-costco-october-2025-11837388,0,www.allrecipes.com,Over 2 Million Pounds of Popular Meat Products Sold at Costco and Sam's Club Recalled for Life-Threatening Contaminant,Here's what you need to know.,https://s.yimg.com/ny/api/res/1.2/bUCToP41NawRoRUgGWmxyw--/YXBwaWQ9aGlnaGxhbmRlcjt3PTEyMDA7aD05MDA7Y2Y9d2VicA--/https://media.zenfs.com/en/all_recipes_969/6cca9234fdcb4aabb632d716c53a7bec,2025-10-27T14:31:35Z,,The U.S. Department of Agricultures Food Safety and Inspection Service (FSIS) has announced a recall on over 2 million pounds of ready-to-eat pork jerky sold at Costco and Sams Club that may be conta… [+2016 chars],,en,'West Island'
103,https://www.macrumors.com/2025/10/27/apple-says-iphone-passport-feature-coming-soon/,0,www.macrumors.com,Apple Says U.S. Passport Feature on iPhone is Coming Soon,"You will soon be able to add a digital version of your U.S. passport to your iPhone, according to Jennifer Bailey, vice president of Apple Pay and Apple Wallet.





Bailey reiterated that the feature is coming soon during her keynote at the Money20/20 USA co…",https://images.macrumors.com/t/H1SDDOSvblWea0VS2zQB3IwDIyc=/2000x/article-new/2025/06/ios-26-digital-id-passport-wallet.jpg,2025-10-27T14:41:10Z,,"You will soon be able to add a digital version of your U.S. passport to your iPhone, according to Jennifer Bailey, vice president of Apple Pay and Apple Wallet.
Bailey reiterated that the feature is… [+1229 chars]",,en,'USA'
